ACL Independent Living State Grants,93.369,HHS,"$22,878,000 ",Financial Assistance Programs,,
ACL Centers for Independent Living,93.432,HHS,"$78,305,000 ",Financial Assistance Programs,,
"Affordable Care Act (ACA) Maternal, Infant, and Early Childhood Home Visiting Program",93.505,HHS,"$37,028,000 ",Financial Assistance Programs,,
"Affordable Care Act (ACA) Tribal Maternal, Infant, and Early Childhood Home Visiting Program ",93.508,HHS,"$8,870,000 ",Financial Assistance Programs,,
Grants for New and Expanded Services under the Health Center Program,93.527,HHS,"$388,700,000 ",Financial Assistance Programs,,
Affordable Care Act (ACA) Childhood Obesity Research Demonstration,93.535,HHS,"$3,900,000 ",Financial Assistance Programs,,
National Health Service Corps,93.547,HHS,"$203,610,000 ",Financial Assistance Programs,,
Low Income Home Energy Assistance,93.568,HHS,"$3,395,977,000 ",Financial Assistance Programs,,
Community Services Block Grant,93.569,HHS,"$705,985,000 ",Financial Assistance Programs,,
Community Services Block Grant - Discretionary Awards,93.570,HHS,"$24,960,000 ",Financial Assistance Programs,,
Child Care and Development Block Grant,93.575,HHS,"$2,856,000,000 ",Financial Assistance Programs,,
State Court Improvement Program,93.586,HHS,"$27,930,000 ",Financial Assistance Programs,,
Community-Based Child Abuse Prevention Grants,93.590,HHS,"$39,388,000 ",Financial Assistance Programs,,
Child Care Mandatory and Matching Funds,93.596,HHS,"$2,917,000,000 ",Financial Assistance Programs,,
Grants to States for Access and Visitation Programs,93.597,HHS,"$10,000,000 ",Financial Assistance Programs,,
Head Start,93.600,HHS,"$9,357,742,000 ",Financial Assistance Programs,,
Voting Access for Individuals with Disabilities-Grants for Protection and Advocacy Systems,93.618,HHS,"$4,963,000 ",Financial Assistance Programs,,
Basic Center Grant,93.623,HHS,"$53,744,000 ",Financial Assistance Programs,,
ACA - State Innovation Models: Funding for Model Design and Model Testing Assistance,93.624,HHS,"$116,930,000 ",Financial Assistance Programs,,
Developmental Disabilities Basic Support and Advocacy Grants,93.630,HHS,"$110,940,000 ",Financial Assistance Programs,,
"University Centers for Excellence in Developmental Disabilities Education, Research, and Service",93.632,HHS,"$38,619,000 ",Financial Assistance Programs,,
Basic Health Program (Affordable Care Act),93.640,HHS,"$4,329,753,000 ",Financial Assistance Programs,,
Children's Justice Grants to States,93.643,HHS,"$17,000,000 ",Financial Assistance Programs,,
Stephanie Tubbs Jones Child Welfare Services Program,93.645,HHS,"$267,871,000 ",Financial Assistance Programs,,
Accountable Health Communities,93.650,HHS,"$20,821,000 ",Financial Assistance Programs,,
Title IV-E Foster Care,93.658,HHS,"$5,366,370,000 ",Financial Assistance Programs,,
Title IV-E Adoption Assistance,93.659,HHS,"$2,780,000,000 ",Financial Assistance Programs,,
Social Services Block Grant,93.667,HHS,"$1,582,700,000 ",Financial Assistance Programs,,
Child Abuse and Neglect State Grants,93.669,HHS,"$25,229,000 ",Financial Assistance Programs,,
Family Violence Prevention and Services/Domestic Violence Shelter and Supportive Services,93.671,HHS,"$116,311,000 ",Financial Assistance Programs,,
Mental and Behavioral Health Education and Training Grants,93.732,HHS,"$50,000,000 ",Financial Assistance Programs,,
Preventive Health and Health Services Block Grant,93.758,HHS,"$151,121,000",Financial Assistance Programs,,
State Children's Health Insurance Program,93.767,HHS,"$15,952,148,000 ",Financial Assistance Programs,,
Medicare Part D -- Prescription Drug Coverage,93.770,HHS,"$100,000,000,000 ",Financial Assistance Programs,,
Medicare Part A -- Medicare Hospital Insurance,93.773,HHS,"$296,500,000,000 ",Financial Assistance Programs,,
Medicare Part B -- Medicare Supplementary Medical Insurance,93.774,HHS,"$313,700,000,000",Financial Assistance Programs,,
Medical Assistance Program (Medicaid),93.778,HHS,"$368,404,000,000 ",Financial Assistance Programs,,
"Centers for Medicare and Medicaid Services (CMS) Research, Demonstrations and Evaluations",93.779,HHS,"$500,000 ",Financial Assistance Programs,,
Heart Disease & Stroke Prevention Program and Diabetes Prevention,93.813,HHS,"$69,500,000 ",Financial Assistance Programs,,
Health Careers Opportunity Program,93.822,HHS,"$12,794,000 ",Financial Assistance Programs,,
Area Health Education Centers Infrastructure Development Awards,93.824,HHS,"$36,018,000 ",Financial Assistance Programs,,
ACL Assistive Technology State Grants for Protection and Advocacy,93.843,HHS,"$4,450,000 ",Financial Assistance Programs,,
State Grants for Protection and Advocacy Services,93.873,HHS,"$3,100,000 ",Financial Assistance Programs,,
"Autism Collaboration, Accountability, Research, Education, and Support",93.877,HHS,"$3,548,000 ",Financial Assistance Programs,,
Grants for Primary Care Training and Enhancement,93.884,HHS,"$33,691,000 ",Financial Assistance Programs,,
Nurse Corps Loan Repayment Program,93.908,HHS,"$48,870,000 ",Financial Assistance Programs,,
"Rural Health Care Services Outreach, Rural Health Network Development and Small Health Care Provider Quality Improvement Program",93.912,HHS,"$77,914,000 ",Financial Assistance Programs,,
Grants to States for Operation of State Offices of Rural Health,93.913,HHS,"$8,588,000 ",Financial Assistance Programs,,
HIV Emergency Relief Project Grants,93.914,HHS,"$624,346,000 ",Financial Assistance Programs,,
Disadvantaged Health Professions Faculty Loan Repayment Program,93.923,HHS,"$1,094,000 ",Financial Assistance Programs,,
Scholarships for Health Professions Students from Disadvantaged Backgrounds,93.925,HHS,"$43,120,000 ",Financial Assistance Programs,,
Healthy Start Initiative,93.926,HHS,"$102,974,000 ",Financial Assistance Programs,,
Block Grants for Community Mental Health Services,93.958,HHS,"$504,664,000 ",Financial Assistance Programs,,
Block Grants for the Prevention and Treatment of Substance Abuse,93.959,HHS,"$1,759,816,000 ",Financial Assistance Programs,,
Maternal and Child Health Services Block Grant to the States,93.994,HHS,"$545,235,000 ",Financial Assistance Programs,,
State Commissions,94.003,CNCS,"$128,805,000 ",Financial Assistance Programs,,
AmeriCorps,94.006,CNCS,"$228,724,000 ",Financial Assistance Programs,,
Volunteers in Service to America,94.013,CNCS,"$92,364,000 ",Financial Assistance Programs,,
Non-Profit Security Program,97.008,DHS,"$60,000,000 ",Financial Assistance Programs,,
Flood Insurance,97.022,DHS,"$17,706,000 ",Financial Assistance Programs,,
Emergency Food and Shelter National Board Program,97.024,DHS,"$120,000,000 ",Financial Assistance Programs,,
Emergency Management Performance Grants,97.042,DHS,"$350,100,000 ",Financial Assistance Programs,,
Assistance to Firefighters Grant,97.044,DHS,"$310,500,000 ",Financial Assistance Programs,,
Fire Management Assistance Grant,97.046,DHS,"$56,000,000",Financial Assistance Programs,,
Pre-Disaster Mitigation,97.047,DHS,"$61,447,000 ",Financial Assistance Programs,,
Intercity Bus Security Grants,97.057,DHS,"$2,000,000 ",Financial Assistance Programs,,
Homeland Security Grant Program,97.067,DHS,"$1,067,000,000 ",Financial Assistance Programs,,
Rail and Transit Security Grant Program,97.075,DHS,"$10,000,000 ",Financial Assistance Programs,,
National School Lunch Program,10.555,USDA,"$3,939,947,000 ",Required State Match or Payment,,
Child Care Mandatory and Matching Funds,93.596,HHS,"$1,152,039,000 ",Required State Match or Payment,,
Medicaid Part D Clawback,93.778,HHS,"$11,406,000,000 ",Required State Match or Payment,,
Low Income Housing Tax Credit,NA,other,"$8,310,000,000",Federal Tax Expenditures,,
Recovery Zone Bonds,NA,other,"$420,000,000 ",Federal Tax Expenditures,,
New Markets Tax Credit,NA,other,"$3,500,000,000 ",Federal Tax Expenditures,,
Work Opportunity Tax Credit,NA,other,"$1,320,000,000 ",Federal Tax Expenditures,,
Interest Exclusion Owner-occupied Mortgage Subsidy Bonds,NA,other,"$1,060,000,000 ",Federal Tax Expenditures,,
Film and TV Production Credit,NA,other,"$200,000,000 ",Federal Tax Expenditures,,
Empowerment Zones,NA,other,"$110,000,000 ",Federal Tax Expenditures,,
HUBZones Program,NA,other,"$7,530,000,000",Federal Procurement Programs,,
